<!ELEMENT configuracion_web (nombre, dominio, tecnologias, secciones, configuracion_server)>
<!ELEMENT nombre (#PCDATA)>
<!ELEMENT dominio (#PCDATA)>
<!ELEMENT tecnologias (tecnologia+)>
<!ELEMENT tecnologia (#PCDATA)>
<!ELEMENT secciones (seccion+)>
<!ELEMENT seccion (#PCDATA)>
<!ELEMENT configuracion_server (puerto, base_datos)>
<!ELEMENT puerto (#PCDATA)>
<!ELEMENT base_datos (#PCDATA)>